Name,Term,Type,Project Title,Project Summary,Geographic Focus (Title),Geographic Focus (Data),Map,Department,Collaborator,Links
ALYSSA RICHARDS,Fall 22,Undergraduate,"Paleoecology in the Northern Snake Range, Nevada","Large-scale environmental changes are impacting ecosystems, such as in the Great Basin, where rising temperatures and dryness are stressing species like Utah Juniper. Paleoecology, through packrat middens, offers insights into how organisms responded to past climate shifts. These middens, well-preserved in arid caves, contain identifiable plant and animal remains. At the University of Utah's RED Lab, such data are analyzed, identified, and radiocarbon dated. Researchers are compiling this information into a database for the Neotoma project, allowing global access. The work includes midden processing, data graphing, and poster creation, requiring over 100 hours of effort to complete and present findings.","Northern Snake Range, Nevada","39.217341473967124, -114.1987696163944",World,ENVST,Larry Coats,
ANA CHAVEZ,Fall 22,Undergraduate,"Humans and ecosystems long term adaptations to climate change in the Rocky Mountains (Utah) in the past 12,000 years","Human societies have long adapted to changing climates, and understanding past responses can inform future strategies. Archaeology offers valuable insights into historical adaptations, highlighting alternative approaches to climate challenges. This project focuses on the Wasatch Front, examining how past populations responded to climate shifts by analyzing archaeological site distribution in relation to paleoclimate data. Working with the University of Utah and the Colorado Plateau Archaeological Alliance, the study will digitize and analyze settlement records from the SHPO database. The goal is to create a comprehensive, accessible dataset that reveals patterns in human adaptation to climate across time in this key region.",Wasatch Front,"40.59709904710032, -111.85985464743027",Utah,Anthropology,Brian Codding,
ANDREW LARKIN,Fall 22,Undergraduate,Thermodynamic considerations for carbamate reduction at a Ru catalyst,"To mitigate climate change, capturing and converting atmospheric CO₂ into useful products is essential. Traditional amine-based CO₂ capture methods are energy-intensive and corrosive. In the Saouma lab, researchers aim to streamline this process by directly converting captured CO₂ (as carbamates) into formic acid and methanol using a ruthenium (Ru) hydrogenation catalyst. This project focuses on measuring equilibrium constants and thermodynamic parameters for key Ru-carbamate reactions via UV-vis spectroscopy. By understanding how CO₂ is delivered and reduced at the catalyst, we can reduce energy costs, extend amine lifetimes, and bypass underground storage risks, advancing sustainable fuel and carbon recycling technologies.",Department of Chemistry,"315 S 1400 E, SALT LAKE CITY, UT 84112",Campus,Chemistry,Caroline Saouma,
ANGELINA MILLER,Fall 22,Undergraduate,New Particle Formation Events in the Salt Lake Valley: Understanding the Causes Effects,"Air quality in Utah’s Salt Lake Valley suffers during winter inversions, with harmful pollutants like PM2.5 impacting public health. Atmospheric aerosols, particularly those formed through New Particle Formation (NPF) events, influence both human health and climate by altering radiation and cloud formation. This project analyzes aerosol data collected by a Sizing Mobility Particle Scanner (SMPS), focusing on identifying and understanding NPF events using automated methods. The work involves calibrating the instrument, organizing and analyzing data, mentoring two undergraduates, and preparing a research poster. This project supports better aerosol monitoring and improves our understanding of their role in air quality and climate.",Salt Lake Valley,"40.538538794302966, -111.99331516804001",Utah,Atmospheric Sciences,Gannet Hallar,
APRIL RADFORD,Fall 22,Undergraduate,Comparative Dendroclimatology Methodology,"Utah Juniper (*Juniperus osteosperma*) is underutilized in dendroclimatology due to its irregular growth rings, making traditional measurement methods unreliable. This project aims to validate a new digital technique developed by Dr. William Gray, using high-resolution imaging and Google Earth Pro, tailored for Utah Juniper analysis. April's role is to assess its accuracy by comparing results with traditional measurements using R-Dendro. Overlapping phases include sample collection, preparation, imaging, and data analysis. If successful, this method could unlock centuries of climate data from Utah Juniper, contributing to a publicly accessible database and advancing dendrochronological research in arid regions like Utah’s West Desert.",Utah Museum of Natural History,"301 Wakara Way, Salt Lake City, UT 84108",Campus,ENVST,Mitchell Power,
ARNEL BESIC,Fall 22,Undergraduate,Electropolymerized Organic Mixed Ionic-Electronic Conductors,"Organic mixed ionic electronic conductors (OMIECs) are soft, biodegradable polymers that conduct both ions and electrons, making them promising for biosensors, neuromorphic computing, and energy storage. This project focuses on electropolymerizing thiophene-based OMIECs, which avoid bulky side chains and offer higher charge storage. We analyze ion injection kinetics using spectroelectrochemistry and investigate morphology using AFM, SEM, FTIR, and GIWAXS. OMIECs offer a sustainable, biocompatible alternative to traditional materials, reducing waste and environmental impact while improving device performance and longevity.",Department of Chemistry,"315 S 1400 E, SALT LAKE CITY, UT 84112",Campus,Chemistry,Conor Bischak,
CATHERINE PETERSEN,Fall 22,Undergraduate,Examining the Relationship between Air Quality Trends and Glycemic Outcomes Among Patients With Type 2 Diabetes Mellitu,"Type 2 diabetes mellitus (T2DM) is a chronic disease affecting millions in the U.S., with growing evidence linking air pollution—particularly PM2.5—to worsened glycemic outcomes. This project seeks to evaluate the relationship between temporal trends in PM2.5 exposure and glycemic control among T2DM patients in Utah’s Davis and Salt Lake Counties. The student will build on prior work creating exposure profiles for over 33,000 patients by applying machine learning to assess associations between PM2.5, HbA1c levels, medication use, and demographic factors. This 150-hour project will deepen understanding of pollution’s impact on metabolic health and may inform public health interventions for diabetes care.",Davis and Salt Lake Counties,"40.81904114722847, -111.91851211144414",Utah,Biomedical Informatics,Ramkiran Gouripeddi,
CORINNA MCMURTREY,Fall 22,Undergraduate,"Effect of Volcanism on Aksumite Agriculture: a long-term perspective from the Tigray Plateau, Ethiopia","The Aksumite Empire (c. 50 BCE–700 CE) thrived on Ethiopia’s Tigray Plateau, supported by fertile volcanic soils and advanced agriculture. This research aims to explore how volcanism affected the empire’s agricultural productivity and contributed to its decline by analyzing sediment cores from the region. Using X-ray fluorescence (XRF) to detect volcanic ash and charcoal analysis to study fire activity, the study investigates links among volcanism, climate, fire, and agriculture. Sediment processing, microscopy, and XRF training will be conducted from January to May 2023. Findings may clarify volcanic impacts on Aksumite land use and environmental changes.",Former Aksumite Empire,"14.124210053067497, 38.71706371409174",World,ENVST,Mitchell Power,
DAVID GLUCKMAN,Fall 22,Undergraduate,Albedo Evolution and the Shifting Arctic Ice Pack,"This research focuses on improving climate models by better representing Arctic Ocean ice, particularly differences between multi-year and seasonal ice. Arctic Ocean ice has declined sharply in extent, thickness, and age, driven by factors like warming and ice-albedo feedback. Multi-year ice is thicker, denser, less saline, and rougher than seasonal ice, influencing melting and albedo differently. Building on prior modeling of ice surface topography and albedo evolution, the project will analyze satellite and field data to characterize ice properties throughout the melt season. These data will inform a refined model predicting Arctic albedo dynamics, aiming to enhance climate model accuracy and understanding of sea ice decline.",Arctic Ocean,"81.56082907527572, -137.21740640811157",World,Mathematics,Ken Golden,
GARETH SANDERS,Fall 22,Undergraduate,"Misinformation, Humor & Climate Change: A Content Analysis of TikTok Posts","This research investigates climate change communication on TikTok, focusing on the prevalence and impact of humorous content. TikTok, a rapidly growing platform with over 1.5 billion users, is influential among young audiences but prone to misinformation. The study aims to quantify the proportion of climate-related TikTok posts, identify how many use humor, and assess engagement levels. It also examines the presence and effect of misinformation combined with humor. Using TikAPI, English-language posts from 2021 will be collected and coded for accuracy, humor, and relevance. Regression analysis will predict engagement, informing effective climate communication strategies on social media.",Department of Communication,"40.76407085620636, -111.843603757085",Campus,Communication,Sara Yeo,
HALEY SEGURA,Fall 22,Undergraduate,"Fire history and environmental disturbance reconstruction for Fish Lake, Utah","This research, conducted in the RED Lab under Dr. Andrea Brunelle, uses paleoclimatology methods to reconstruct Fish Lake’s environmental history in Utah. Radiocarbon dating establishes an age model for soil cores, enabling fire history reconstruction through charcoal analysis. The study focuses on a significant fire event around 5,000 years ago, examining charcoal and pollen samples before, during, and after the fire to understand fire frequency, intensity, and ecological response. Additional environmental disturbances will be analyzed using XRF, LOI, and magnetic susceptibility. The work includes presenting at the PACLIM Conference and completing an honors thesis by April 2023.",Fish Lake,"38.55234130527016, -111.70980791256085",Utah,ENVST,Andrea Brunelle,
JOHN KOCH,Fall 22,Undergraduate,Salt Lake Valley Lake Effect Research,"This project investigates the Great Salt Lake’s lake breezes, their evolution over the past decade, and their relationship to the lake’s recession, focusing on Western climate phenomena in the Salt Lake Valley. Using publicly available climate data and Python-based visualization, it models the lake effect's role in moderating summer heat, driving lake-effect snowstorms, and influencing winter inversions. The study examines how declining lake volume impacts these phenomena, particularly during extreme heatwaves and snow events. Preliminary models analyze temperature and wind patterns during a 2021 heatwave. The research, conducted with Dr. Holmes, aims to clarify the lake effect’s critical role in the valley’s climate and its vulnerability to the lake’s recession.",Great Salt Lake,"41.18817277487803, -112.59823976458841",Utah,Atmospheric Sciences,Heather Holmes,
KITSEL LUSTED,Fall 22,Undergraduate,Analyzing Utah‚Äôs Snowpack using Synthetic Aperture Radar,"This project addresses inaccuracies in snowpack measurement in Utah’s mountainous terrain due to coarse satellite imagery resolution. It uses interferometric synthetic aperture radar (InSAR) data collected in 2021 from Mt. Superior, Little Cottonwood Canyon, to measure changes in snow depth and snow water equivalent (SWE). By analyzing radar coherence between repeated scans during and after storm events, the study aims to assess how liquid water influences SWE detection. Data will be validated with snow pits and SnoTel records. Findings will inform NASA’s upcoming NISAR satellite mission on snowpack monitoring and improve understanding of snow dynamics in complex terrain.",Mount Superior,"40.59270567823573, -111.66678677525948",Utah,Materials Science Engineering,Rick Forster,
LEO BLOXHAM,Fall 22,Undergraduate,Tuning Phase Transitions in Copper and Manganese Based 2-D Hybrid Halide Perovskite,"This research focuses on synthesizing and analyzing copper- and manganese-based two-dimensional (2-D) hybrid halide perovskites for their thermal energy storage potential. Unlike lead-based perovskites, these alternatives aim to avoid toxic metals while exploring phase transition tunability through varying alkyl chain lengths. The project involves synthesizing compounds with decylammonium and octylammonium cations, characterizing their structure via x-ray diffraction, and measuring phase transition temperatures using thermal and optical methods. The goal is to understand how blending different alkyl chains affects the phase transition, enabling tailored thermal storage materials to reduce energy consumption for heating and cooling.",Department of Chemistry,"315 S 1400 E, SALT LAKE CITY, UT 84112",Campus,Chemistry,Conor Bischak,
LILLIE CONGRAM,Fall 22,Undergraduate,Does xylem plasticity of Populus tremuloides as a result of repeated severe droughts increase or decrease resilience to climate change?,"This research investigates the adaptability (plasticity) of the water transport system in trembling aspen trees (Populus tremuloides) under drought stress, focusing on Sudden Aspen Decline (SAD) in the western U.S. The study examines xylem vessels and membrane-bound pits, which facilitate water transport but can be vulnerable to air seeding during drought, impairing photosynthesis. Using a common garden experiment with different drought treatments, the researcher measures vessel diameter, pit size, and density before and after drought periods. The goal is to determine if these traits adapt to drought or are genetically fixed, impacting forest resilience and carbon storage under climate change.",School of Biological Sciences,"257 South 1400 East, 201, SALT LAKE CITY, UT 84112",Campus,Biology,William Anderegg,
MARY ROALSTAD,Fall 22,Undergraduate,The Leaky Pipe: How Urban Contributions to Surface Waters Introduce Flux that Critically Alters Water Quality and Groundwater Interaction,"This research investigates the impact of urbanization on water quality in Red Butte Creek, focusing on point-source pollution from leaking sewers and impervious surfaces around the University of Utah campus. Using long-term data from the Wasatch Environmental Observatory and the GAMUT network, the study analyzes chemical concentrations and isotopic signatures to differentiate natural environmental fluxes from human-caused contamination. The goal is to understand how stream ecosystems recover from sewage leaks over time by modeling pollutant degradation, mapping pollution hotspots, and visualizing impervious surface coverage. This work aims to inform urban watershed management and pollution mitigation strategies.",Red Butte Creek,"40.76746144381872, -111.82493868783116",Campus,Geology & Geophysics,Paul Brooks,
NANCY SOHLBERG,Fall 22,Undergraduate,"A Climatology of Dust Events Impacting Snow Melt at the Atwater Study Plot in Alta, UT","This research examines the increasing frequency and intensity of dust events impacting snowmelt in Utah’s Wasatch Range, particularly from the dry lakebed of the Great Salt Lake. Dust reduces snow albedo, accelerating melt and threatening both Salt Lake City’s water supply and the ski economy. Using aerosol data from the GRIMM spectrometer at Alta’s Atwater Study Plot and back-trajectory modeling via STILT, the project will identify trends in dust particle size, origin, and event frequency over five spring seasons (2017–2022). Findings will support environmental policy and water management by highlighting the need to address dust emissions from shrinking lakebeds.",Alta’s Atwater Study Plot,"40.590862681178194, -111.63841814183455",Utah,Atmospheric Sciences,Gannet Hallar,
NASH WARD,Fall 22,Undergraduate,The effect of multi-scalular fractals on the albedo of the ice pack,"This research investigates how the fractal geometry of Arctic Ocean ice influences wave propagation, with implications for sea ice stability in a warming climate. As Arctic Ocean ice thins and becomes more saline, understanding how waves travel through the fragmented ice pack is critical. Researchers will use a mathematically rigorous box-counting method in MATLAB to calculate the fractal dimension of ice floe patterns from aerial images. These data will be integrated into a new model of sea ice viscoelasticity to assess mechanical behavior. The project also aims to clarify the debated relationship between floe size distribution and fractal dimension in geoscience literature.",Arctic Ocean,"83.99114994875666, -135.88444451639523",World,Mathematics,Ken Golden,
RYLIE BURKE,Fall 22,Undergraduate,Leveraging NEON to Build a Predictive Cross-scale Theory of Ecosystem Transpiration,"This research investigates how plants regulate water use, focusing on stomatal response to climate changes such as drought. Despite extensive prior study, a clear theory of ecosystem water regulation is lacking. By analyzing seasonal transpiration patterns across grasses, shrubs, and trees, the project seeks to understand species-specific water sources and their variability with precipitation, evaporation, elevation, and soil depth. The work involves cryogenic water extractions of plant and soil samples for isotope analysis, followed by data processing and visualization using Excel and R. Weekly mentorship meetings and literature reviews support ongoing interpretation of data collected from sites across the U.S.",Department of Geology and Geophysics,"115 S 1460 E, Room 383, Salt Lake City, UT 84112",Campus,Geology & Geophysics,Gabriel Bowen,
SAM HOFFMAN,Fall 22,Undergraduate,Paleoecological Reconstruction of the late Pleistocene,"This research focuses on reconstructing the late Pleistocene climate and environment of the Great Basin through analysis of packrat middens from Smith Creek Canyon in eastern Nevada. These middens, preserved in limestone caves, contain plant and animal material that reveal valuable ecological data. The researcher has been processing and analyzing these samples in the RED Lab by soaking, drying, and sorting midden contents. Identification sessions with colleagues and faculty assist in species documentation. Future steps include radiocarbon dating of samples and creating graphs to illustrate climatic trends during the Pleistocene, contributing to a broader understanding of environmental change in this arid region.",Smith Creek Canyon,"41.014664394025296, -115.39178346354338",World,ENVST,Larry Coats,
TALON ROBERTS,Fall 22,Undergraduate,"A geospatial and climatic analysis of the rise and fall of the Aksumite Empire on the Tigray Plateau, Ethiopia","This research investigates the environmental and human factors behind the collapse of the Aksumite Empire (\~700 A.D.) in Ethiopia by analyzing sediment-based fire history and climate data. Using charcoal samples collected near Adigrat, Ethiopia, the study reconstructs past fire events and examines their relationship with long-term climate variability and human activity, such as ancient agricultural burning. The research involves compiling paleoclimate records, analyzing sediment charcoal through microscopy, and applying statistical tools (CharAnalysis) to identify patterns like mega-droughts. It also explores climate drivers like shifts in the Intertropical Convergence Zone (ITCZ) and Indian Ocean Dipole (IOD) to understand drought mechanisms. The goal is to build a multi-proxy framework linking fire, climate, and societal changes to better understand the collapse of the Aksumite Empire. Key milestones include literature reviews, lab analyses, data modeling, and a presentation at UCUR in February 2023.",Former Aksumite Empire,"14.124210053067497, 38.71706371409174",World,ENVST,Mitchell Power,
TODD CLARK,Fall 22,Undergraduate,Quantifying urban temperature and land-use changes in the Salt Lake Valley from 1998-2019,"More research is needed to understand regional temperature differences between urban Salt Lake Valley and surrounding rural areas. This study aims to analyze temperature trends from 1998 to 2019 using meteorological data from Mesowest, historical thermal maps, and recent land cover data from the National Land Cover Database. By correlating temperature changes with land-use modifications, the research seeks to quantify the urban heat island effect in the valley. Unlike previous satellite-based studies, this approach uses air temperature data to better represent human experience. The project also examines how development has altered surface types and local climate over time.",Salt Lake Valley,"40.65220552088848, -112.05725457595496",Utah,Atmospheric Sciences,Heather Holmes,
VIVIAN MARCOUX,Fall 22,Undergraduate,Climate Change and Cyanobacteria: What Awaits the Great Salt Lake?,"This research focuses on quantifying Cyanobacteria populations in Utah’s Great Salt Lake, a unique high-salinity environment with distinct northern and southern arms. The study will examine how Cyanobacteria biomass correlates with salinity, temperature, and depth across multiple sites, including areas near a causeway breach influencing salinity balance. Data collection will involve water sampling and laboratory analysis to measure Cyanobacteria abundance, salinity, and pH. The goal is to model the relationship between environmental factors and Cyanobacteria dynamics, providing insight into the lake’s ecosystem health and broader implications for global aquatic systems affected by climate-driven salinity changes.",Great Salt Lake,"40.918012424846516, -112.35496408804",Utah,Civil & Environmental Engineering,Ramesh Goel,
ZOE EXELBERT,Fall 22,Undergraduate,Hydroclimate Vulnerability Assessment of the Great Salt Lake on Bird Migratory Pattern Ecosystem Influence,"This research examines how hydroclimatic variability impacts bird populations and ecosystem health at Utah’s Great Salt Lake, a critical habitat for over 10 million birds of 338 species. Using migration data from the National Audubon Society alongside climate and lake-level data, the study explores relationships among temperature, precipitation, lake salinity, and bird migration timing. Integrating meteorological and biological datasets with programming tools like Python, MATLAB, and R, the project aims to model hydroclimate vulnerability and simulate ecosystem responses. The goal is to assess how climate-driven changes threaten this unique ecosystem and guide potential ecological restoration efforts.",Great Salt Lake,"41.33281920099406, -112.71290384806427",Utah,Atmospheric Sciences,Court Strong,
ABBIE NISTLER,Spring 23,Undergraduate,Biodegradable commodity polymers,"The project focuses on developing biodegradable commodity polymers to address the environmental persistence of conventional polyolefins, which are cheap, scalable, and widely used but non-biodegradable. Researchers aim to maintain low costs and compatibility with current manufacturing while improving biodegradability by modifying polymer backbones, adjusting functional groups, and exploring hydrophilicity. From June to December, the team will synthesize PS-PEO polymers of varying molecular weights, analyze them using spectroscopy and microscopy techniques, and assess their water absorption and degradability. Later stages involve adding starch to facilitate microbial breakdown. Repeated testing ensures thorough understanding of degradation conditions and polymer performance.",Department of Materials Science and Engineering,"122 S. Central Campus Drive, #304, Salt Lake City, Utah 84112",Campus,Materials Science Engineering,Jeffrey Bates,
AIDAN MACE,Spring 23,Undergraduate,Rock glaciers and climate change in High Mountain Asia,"This project investigates the hydrological role and distribution of rock glaciers in High Mountain Asia, a region critical for water supply to 1.3 billion people. As climate change accelerates glacial melt, understanding resilient features like rock glaciers is vital due to their substantial water storage capacity. The study will focus on mapping rock glaciers using Google Earth and ArcGIS Pro, analyzing variables like elevation, slope, and temperature to determine distribution factors. Hydrological storage will be estimated using established methodologies. Fieldwork in Utah’s Timpanogos Glacier will support interpretation of satellite imagery. Findings will culminate in an undergraduate thesis on regional water sustainability.",Karakoram Mountains,"36.00081175981446, 76.00013519104597",World,Geology & Geophysics,Leif Anderson,
ANDREW TOLTON,Spring 23,Undergraduate,Computationally Improving Organic Photovoltaic Efficiency,"This project aims to improve Organic Photovoltaics (OPVs), a promising alternative to traditional silicon solar cells due to their low cost, eco-friendly materials, and design flexibility. Despite their advantages, OPVs suffer from low power conversion efficiency (PCE) and short lifetimes, limiting commercialization. The student builds on prior research in organic thermoelectrics to develop a computational model simulating OPV efficiency, focusing on how doping and energetic disorder impact performance. Over the semester, they will conduct literature review, write and test simulation code, analyze how disorder affects PCE, and identify optimal material properties.",Department of Materials Science and Engineering,"122 S. Central Campus Drive, #304, Salt Lake City, Utah 84112",Campus,Materials Science Engineering,Zlatan Aksamija,
