Name,Term,Type,Project Title,Project Summary,Geographic Focus (Title),Geographic Focus (Data),Map,Department,Collaborator,Links
Aspen Marshall ,Fall 25,Undergraduate,Summertime Air Quality Disparities in Salt Lake City,"Air quality varies across Salt Lake City during the summer due to differences in traffic density, industrial activity, land cover, and neighborhood characteristics. This project investigates spatial disparities in summertime air pollution exposure, with a focus on understanding how environmental conditions affect different communities. Using air-quality monitoring data, geographic information systems (GIS), demographic information, and statistical analyses, researchers identify pollution hotspots and evaluate relationships between air quality, socioeconomic factors, and urban infrastructure. The study seeks to determine whether certain populations experience disproportionate exposure to harmful pollutants and to provide evidence that can inform environmental justice initiatives, public health policies, and urban planning decisions.","Salt Lake City, Utah, USA","40.760779, -111.891047",Utah,Atmospheric Sciences ,Jessica Haskins,
Kaylee Meyers ,Fall 25,Undergraduate,Mammals on the Move: Spatiotemporal Response of Common US Mammals to Extreme Weather Events,"Extreme weather events such as heat waves, droughts, floods, wildfires, and severe storms are becoming more frequent and intense under climate change, affecting wildlife across the United States. This project investigates how common mammal species respond to these events by analyzing changes in their spatial distribution, movement patterns, and habitat use over time. Using wildlife observation databases, remote sensing products, climate records, and spatial modeling techniques, researchers identify behavioral and ecological responses to environmental disturbances. The study aims to determine which species are most vulnerable or adaptable to extreme conditions, providing insights that can inform wildlife conservation, habitat management, and climate adaptation strategies.",United States,"39.828300, -98.579500",World,Biochemistry,Austin Green,
Sofia Mocuta ,Fall 25,Undergraduate,Investigating Effects of Fine Scale Air Quality Changes on Animal Behavior,"Air pollution can influence animal health, movement, communication, and habitat use, yet its behavioral effects at fine spatial scales remain poorly understood. This project investigates how localized variations in air quality affect animal behavior by integrating high-resolution pollution measurements with wildlife observations and behavioral monitoring data. Researchers examine whether short-term changes in pollutants such as particulate matter, ozone, or nitrogen dioxide alter activity patterns, foraging behavior, movement, or habitat selection. Using spatial and statistical analyses, the study identifies behavioral responses to environmental stressors and evaluates species-specific sensitivity to air pollution. Findings contribute to understanding ecological impacts of air quality and support conservation efforts in increasingly urbanized environments.","Salt Lake Valley, Utah, USA","40.760800, -111.891000",Utah,Atmospheric Sciences ,Austin Green,
Chance Moran ,Fall 25,Undergraduate,Forecasting Biological Regimes of Great Salt Lake,"The Great Salt Lake is experiencing rapid ecological change due to declining water levels, increasing salinity, and climate-driven environmental pressures. This project forecasts future biological regimes of the lake by examining how changing physical and chemical conditions influence key organisms, including microbes, brine shrimp, and brine flies that support the lake’s food web. Using long-term monitoring data, ecological models, and climate projections, researchers evaluate potential shifts in species composition, productivity, and ecosystem function under different environmental scenarios. The study aims to identify ecological thresholds and improve predictions of lake resilience, providing information that can guide conservation, water-management decisions, and protection of the Great Salt Lake ecosystem.","Great Salt Lake, Utah, USA","41.170000, -112.530000",Utah,Mathematics,Jody Reimer,
Aditya Pandey ,Fall 25,Undergraduate,"Assessing Climate Driven Erosional Risk in Exposed Reservoir Mud Deposits Using Soil Properties, Mineralogy and Geochemistry in Colorado River Tributaries, Utah, USA","Declining reservoir levels in the Colorado River Basin have exposed extensive mud deposits that were previously submerged beneath Lake Powell and its tributary inlets. This project assesses the risk of climate-driven erosion and sediment remobilization in these newly exposed landscapes using analyses of soil properties, mineralogy, and geochemistry. Researchers collect and characterize sediment samples to determine how texture, mineral composition, salinity, and chemical properties influence susceptibility to wind and water erosion. By linking sediment characteristics with climate projections and hydrologic conditions, the study identifies areas most vulnerable to erosion. Results improve understanding of landscape response to reservoir decline and inform management of environmental hazards, water quality, and ecosystem recovery in the Colorado River Basin.","Colorado River Tributaries and Exposed Lake Powell Sediments, Utah, USA","37.068000, -111.290000",Utah,Geoscience,Brenda Bowen,
Chloe Raymond,Fall 25,Undergraduate,The effect of summer drought on seasonal leaf area dynamics and autumn phenology in aspen trees,"Climate change is increasing the frequency and severity of summer droughts, potentially altering the seasonal growth patterns and autumn senescence of aspen forests. This project investigates how summer water stress affects leaf area dynamics throughout the growing season and influences the timing and progression of autumn phenology in quaking aspen (Populus tremuloides). Using field measurements, canopy monitoring, remote sensing data, and physiological assessments, researchers evaluate relationships among drought intensity, leaf production, canopy retention, and fall color change. The study aims to improve understanding of how drought affects forest productivity and seasonal development, providing insights into the future resilience of aspen ecosystems under changing climatic conditions.","Aspen Forests of the Wasatch and Uinta Mountains, Utah, USA","40.620000, -111.720000",Utah,Biology,William Anderegg,
Brianna Rinn ,Fall 25,Undergraduate,Role of climate of origin and phylogenetic relatedness in the response of stem photosynthesis to drought,"Many woody plants perform stem photosynthesis, a process that can contribute to carbon gain and improve survival during environmental stress. This project investigates how climate of origin and phylogenetic relatedness influence the response of stem photosynthesis to drought across different plant species. Through controlled drought experiments, gas-exchange measurements, and comparative analyses, researchers assess whether species from drier climates or closely related evolutionary lineages exhibit similar physiological responses. The study examines how stem photosynthetic capacity changes under water limitation and evaluates the role of evolutionary history in shaping drought tolerance. Findings improve understanding of plant adaptation to climate stress and help predict vegetation responses to increasing drought under future climate change.","Intermountain West Plant Physiology Research Sites, Utah, USA","40.764936, -111.842102",Utah,Earth and Environmental Science Environmental and Sustainability Studies ,Eleinis Avila-Lovera,
Abigail Rupper ,Fall 25,Undergraduate,Social and environmental predictors of emigration from Latin America to the US southern border,"Migration from Latin America to the United States is influenced by a complex combination of social, economic, political, and environmental factors. This project investigates how environmental conditions such as drought, extreme weather, and resource scarcity interact with social drivers including poverty, violence, governance, and employment opportunities to shape migration toward the U.S. southern border. Using demographic datasets, climate records, migration statistics, and spatial modeling techniques, researchers identify patterns and predictors of emigration across Latin America. The study seeks to improve understanding of climate-related migration and human mobility, providing insights that can inform policy development, humanitarian planning, and responses to environmental and social change.",Latin America and the U.S.–Mexico Border Region,"23.500000, -102.000000",World,International Studies ,Andrew Linke,
Zvonimir Simic,Fall 25,Undergraduate,Using content analysis to assess news articles for dominant knowledge frames about urban trees,"Urban trees provide numerous ecological, social, and economic benefits, yet public understanding of their value is often shaped by media coverage. This project uses content analysis to examine news articles and identify dominant knowledge frames used to discuss urban trees. Researchers systematically code articles for recurring themes, narratives, sources of expertise, and representations of benefits and challenges associated with urban forestry. The study evaluates how media framing influences public perceptions of issues such as climate resilience, environmental justice, public health, biodiversity, and urban development. Findings contribute to communication research and urban forestry policy by revealing how knowledge about urban trees is constructed and disseminated through news media.",Urban Areas of the United States,"39.828300, -98.579500",World,Environmental & Sustainability Studies ,Matthew Fry ,
William Summa ,Fall 25,Undergraduate,Developing a Forecast Tool for Fire-Initiated Thunderstorms,"Fire-initiated thunderstorms, or pyrocumulonimbus (PyroCb) events, are rare but powerful atmospheric phenomena that can intensify wildfire impacts and loft smoke into the upper troposphere and lower stratosphere. This project develops a forecast tool to identify when active fires are likely to trigger PyroCb formation by combining wildfire characteristics, heat flux estimates, weather forecasts, and vertical atmospheric profiles. Using numerical modeling and ensemble simulations, the study evaluates how fuel, fire behavior, instability, moisture, and wind interact to produce these storms. The resulting tool could improve wildfire operations, smoke forecasting, and public health preparedness during extreme fire seasons across North America.","University of Utah, Salt Lake City, Utah, USA","40.764936, -111.842102",Campus,Atmospheric Sciences ,Derek Mallia,
Estella Szasz ,Fall 25,Undergraduate,Resolving “Lake Currey” in the Bonneville Basin through Paleoenvironmental Proxy Methods,"Lake Bonneville was a vast Pleistocene lake whose fluctuating shorelines and sub-basins recorded major climatic and hydrologic changes in the Great Basin. This project investigates the history of “Lake Currey,” a proposed lake phase or sub-basin within the Bonneville Basin, using paleoenvironmental proxy methods to reconstruct past environmental conditions. Researchers analyze sediment cores, geochemical signatures, microfossils, stratigraphy, and other proxy records to determine changes in lake levels, water chemistry, and regional climate over time. By resolving the timing and characteristics of Lake Currey, the study improves understanding of Great Basin paleoclimate dynamics and provides insights into long-term hydrologic responses to climate variability.","Bonneville Basin, Great Basin, Utah, USA","40.700000, -113.800000",Utah,Environmental & Sustainability Studies ,Andrea Brunelle,
Kathryn Von Rosen ,Fall 25,Undergraduate,Graphic Design Aesthetic Activism - The Exploration of Gen Z Digital Thrift Culture in Second Hand Resale Fashion,"Graphic design plays a growing role in shaping digital activism and sustainable consumer culture among Generation Z. This project explores how graphic design functions as a form of aesthetic activism within online second-hand resale fashion communities. Through analysis of social media content, branding strategies, visual communication, and user-generated designs, researchers examine how digital thrift culture promotes sustainability, anti-consumerism, self-expression, and environmental awareness. The study investigates how visual aesthetics influence engagement, identity formation, and purchasing behaviors on resale platforms. By connecting graphic design, activism, and fashion, the project provides insight into how Gen Z uses digital media to advocate for more sustainable and socially conscious consumption practices.",United States Digital Resale Fashion Communities,"39.828300, -98.579500",World,Graphic Design,Carol Sogard,
Simone Arai Wiatrak ,Fall 25,Undergraduate,"Perceived Health, Susceptibility, and Responsibility: A Survey-Based Approach","Individual perceptions of health, personal susceptibility to illness, and responsibility for health-related outcomes play important roles in shaping behaviors and decision-making. This project uses a survey-based approach to examine how people perceive their overall health, assess their vulnerability to health risks, and attribute responsibility for maintaining health to themselves, communities, healthcare systems, or public institutions. Researchers analyze survey responses using quantitative statistical methods to identify patterns across demographic and social groups. The study seeks to understand factors that influence health attitudes and behaviors, providing insights that can inform public health communication, health education initiatives, and strategies for promoting preventive care and well-being.","Salt Lake City, Utah, USA","40.760779, -111.891047",Utah,Communication,TAE KYOUNG LEE,
Peter Wilhelm ,Fall 25,Undergraduate,Modeling Organic Charge Transport Using a Modified Inorganic p-n Junction Simulation,"Organic semiconductors are promising materials for flexible electronics, solar cells, and next-generation optoelectronic devices, but their charge transport behavior differs significantly from that of traditional inorganic materials. This project adapts and modifies an inorganic p–n junction simulation framework to model charge transport in organic electronic systems. By incorporating mechanisms such as hopping transport, exciton dynamics, disorder effects, and organic material properties, researchers evaluate how well modified semiconductor models can predict carrier movement and device performance. The study aims to improve understanding of charge transport in organic materials, refine computational modeling techniques, and support the design of more efficient organic photovoltaic and electronic devices.","University of Utah, Salt Lake City, Utah, USA","40.764936, -111.842102",Campus,Mechanical Engineering ,Zlatan Aksamija,
Kimhabin Yoon ,Fall 25,Undergraduate,Enhancing Low-Cost NO₂ Sensor Accuracy with Image Processing in Transit-Heavy Urban Zones,"Nitrogen dioxide (NO₂) is a harmful air pollutant commonly concentrated near major transportation corridors, where accurate monitoring is essential for assessing human exposure and environmental health risks. This project investigates how image-processing techniques can improve the performance of low-cost NO₂ sensors deployed in transit-heavy urban zones. By analyzing visual sensor outputs and applying calibration algorithms, researchers seek to reduce measurement uncertainty caused by lighting conditions, sensor drift, and environmental variability. The study compares sensor readings with reference-grade instruments to evaluate accuracy improvements. Results may enable more affordable and reliable air-quality monitoring networks, supporting urban planning, public health research, and environmental justice initiatives.","Transit-Heavy Urban Corridors, Salt Lake City, Utah, USA","40.760779, -111.891047",Utah,Electrical Engineering ,Hanseup Kim,
Sydney Smith ,Fall 25,Undergraduate,Impact of Clausius-Clapeyron Thresholds and Monsoon Patterns on Extreme Precipitation Events in the Salt Lake Region,"Extreme precipitation events in the Salt Lake region are influenced by complex interactions among atmospheric moisture, temperature, and seasonal weather patterns. This project investigates how Clausius–Clapeyron scaling thresholds, which describe the relationship between air temperature and atmospheric moisture capacity, interact with North American monsoon dynamics to affect heavy rainfall events. Using meteorological observations, radar data, climate records, and statistical analyses, researchers examine whether precipitation extremes increase at rates consistent with theoretical expectations and how monsoonal moisture contributes to these events. The study improves understanding of regional hydroclimate processes, helping refine flood-risk assessments and projections of extreme weather under future climate change.","Salt Lake Valley, Utah, USA","40.760779, -111.891047",Utah,Environmental & Sustainability Studies ,Court Strong,
Bridget Voortmeyer ,Spring 26,Undergraduate,"Late Holocene Vegetation Change in Range Creek Canyon, Utah: Investigating Cherry Meadows as an Agricultural Site","Range Creek Canyon preserves an exceptional record of prehistoric human occupation and environmental change in eastern Utah. This project investigates late Holocene vegetation dynamics at Cherry Meadows to evaluate whether the area functioned as an agricultural site used by Fremont peoples. Using paleoenvironmental proxy methods—including pollen analysis, phytoliths, charcoal records, sedimentology, and plant macrofossils—researchers reconstruct past vegetation, fire activity, and land-use patterns. The study compares evidence of natural environmental change with indicators of human cultivation and landscape modification. Results help clarify the extent of prehistoric agriculture in Range Creek Canyon and contribute to broader understanding of human–environment interactions in the ancient Great Basin and Colorado Plateau.","Cherry Meadows, Range Creek Canyon, Utah, USA","39.734000, -110.424000",Utah,Environmental & Sustainability Studies ,Andrea Brunelle,
Pavan Vasa ,Spring 26,Undergraduate,Machine Learning for Sustainable Manufacturing: Optimizing Cold Spray Deposition for Critical Energy Applications,"Cold spray deposition is an advanced manufacturing process that uses high-velocity particles to create coatings and components without melting the feedstock material, making it attractive for energy and infrastructure applications. This project applies machine learning techniques to optimize cold spray deposition parameters for sustainable manufacturing of materials used in critical energy systems. By analyzing experimental and process data, researchers develop predictive models that relate spray conditions to coating quality, deposition efficiency, material performance, and energy consumption. The study aims to identify optimal processing conditions that reduce waste, improve reliability, and enhance manufacturing efficiency. Results support the development of more sustainable production methods for energy technologies and advanced materials.","University of Utah, Salt Lake City, Utah, USA","40.764936, -111.842102",Campus,Computer Science ,Suhas Prameela,
Zachary Rhoades ,Spring 26,Undergraduate,"Analyzing δ18O and δ13C Isotope Data to Reconstruct an Ancient Climate System in the Cape Floristic Region, Southern Africa","Stable isotope records provide valuable evidence of past environmental and climatic conditions. This project analyzes δ¹⁸O and δ¹³C isotope data to reconstruct ancient climate dynamics in the Cape Floristic Region of southern Africa, one of the world's most biodiverse Mediterranean-type ecosystems. Using geochemical measurements from carbonate deposits, fossil materials, or sediment archives, researchers investigate past variations in temperature, precipitation, vegetation, and hydrologic processes. The study evaluates how regional climate systems responded to natural environmental change over time and how those changes influenced ecosystem development. Results contribute to paleoclimate reconstruction efforts and improve understanding of long-term climate variability in southern Africa.","Cape Floristic Region, Western Cape, South Africa","-33.900000, 18.450000",World,Geoscience,Alexandra Norwood,
Kayleah Madsen,Spring 26,Undergraduate,Climate Change and Hybridization: Bristlecone-Pinyon Pine Interactions in Utah,"Climate change is altering species distributions and increasing opportunities for hybridization among closely related tree species. This project investigates interactions between Great Basin bristlecone pine (Pinus longaeva) and pinyon pine (Pinus monophylla and related species) in Utah to determine how changing environmental conditions may influence gene flow, hybrid formation, and species boundaries. Through field sampling, genetic analyses, and ecological assessments, researchers examine patterns of hybridization across environmental gradients and evaluate whether climate-driven range shifts are increasing contact between populations. The study provides insight into evolutionary responses to climate change and helps predict how forest communities may adapt to future environmental conditions.","Southern Utah Mountain Ranges, USA","37.850000, -112.250000",Utah,Environmental & Sustainability Studies ,Mitchell Power,
Hyein Kim ,Spring 26,Undergraduate,Comparative Analysis of Wildfire Resilience Strategies in Utah and South Korea,"Wildfires are increasing in frequency and severity worldwide, creating a need for effective resilience and adaptation strategies. This project compares wildfire resilience approaches in Utah and South Korea to identify similarities, differences, and opportunities for improving fire management. Through policy analysis, case studies, environmental data, and stakeholder perspectives, researchers evaluate prevention measures, emergency response systems, forest management practices, community preparedness, and post-fire recovery efforts. The study examines how differences in climate, vegetation, governance, and population density influence wildfire risk and resilience. Findings provide insights into best practices for reducing wildfire impacts and strengthening community adaptation to a changing climate.","Utah, USA and South Korea","38.900000, 7.550000",Utah,Urban Ecology ,DIVYA CHANDRASEKHAR,
Byron Wuollet ,Spring 26,Undergraduate,Variation in non-structural carbohydrates in rubber rabbitbrush in two contrasting UofU gardens,"Non-structural carbohydrates (NSCs) serve as important energy reserves that influence plant growth, survival, and responses to environmental stress. This project investigates variation in NSC concentrations in rubber rabbitbrush (Ericameria nauseosa) growing in two contrasting University of Utah gardens with differing environmental conditions. Through seasonal sampling and laboratory analyses of plant tissues, researchers measure stored sugars and starches to evaluate how factors such as water availability, temperature, soil conditions, and microclimate affect carbon allocation. The study improves understanding of plant physiological responses to environmental variability and provides insight into the adaptive strategies of native Great Basin shrub species under changing climatic conditions.","University of Utah Gardens, Salt Lake City, Utah, USA","40.764936, -111.842102",Campus,Biology,Eleinis Avila-Lovera,
Isaac Wells ,Spring 26,Undergraduate,Age effects of Aspen sapwood percentage with relation to differing traits and climate variables,"Sapwood is the living portion of a tree stem responsible for water transport and storage, and its proportion relative to stem size can influence physiological performance and climate resilience. This project investigates how aspen sapwood percentage changes with tree age and how these changes relate to functional traits and environmental variables. Through field measurements, tree-core analyses, and climate data integration, researchers examine relationships among sapwood area, growth rates, water-use characteristics, drought exposure, and temperature conditions. The study seeks to determine whether age-related shifts in sapwood allocation affect tree function and vulnerability to climate stress, improving understanding of aspen adaptation and forest responses to environmental change.","Aspen Forests of the Wasatch and Uinta Mountains, Utah, USA","40.620000, -111.720000",Utah,Environmental & Sustainability Studies ,Huiying Xu,
Spencer Spader ,Spring 26,Undergraduate,Cost and Performance Comparison of Residential Wall Assemblies in Utah’s Climate,"Residential wall assemblies play a critical role in building energy efficiency, durability, comfort, and construction costs. This project compares the cost and performance of different wall assembly designs suited to Utah’s climate, evaluating factors such as thermal resistance, moisture control, energy consumption, construction expense, and long-term durability. Using building simulations, material cost analyses, and performance modeling, researchers assess how various wall systems respond to Utah’s temperature extremes and seasonal conditions. The study aims to identify cost-effective designs that improve energy efficiency and occupant comfort while reducing environmental impacts. Findings can inform builders, homeowners, architects, and policymakers seeking sustainable housing solutions.","Utah, USA","39.321000, -111.093700",Utah,Architectural Studies ,Jörg Rügemer,
