Name,Term,Type,Project Title,Project Summary,Geographic Focus (Title),Geographic Focus (Data),Map,Department,Collaborator,Links
Annabelle Bosworth,Summer 25,Undergraduate,Reducing Invasive Russian Thistle in Utah,"This research addresses the invasive weed Salsola tragus (Russian thistle), which harms crop yields, spreads plant viruses, and creates fire hazards in Utah. Current management methods like herbicides harm native plants, and hand-pulling is inefficient. A potential solution exploits S. tragus’s vulnerability to mycorrhizal fungi, which can damage its root system. The study will test the effects of mycorrhizal inoculants and reseeding native grasses on S. tragus control in plots at Camp Williams and Dugway Proving Grounds. Plant growth, fungal communities, and biodiversity will be monitored from May to August to evaluate treatment efficacy and ecological impacts.",Camp Williams and Dugway Proving Grounds,"40.432796004320004, -111.93782128976524",Utah,Biology,Luiza Aparecido,
Camryn Carr,Summer 25,Undergraduate,Hydrologic Shifts from Climate Change: A Study of Two High Mountain Watersheds,"This research investigates how precipitation events affect stream chemistry in two high-mountain watersheds near Salt Lake City: Albion Basin and Red Butte Creek. These watersheds differ in geology, land cover, elevation, and groundwater storage, influencing water quality responses to climate change. The study will collect water samples and continuous sensor data on solutes, discharge, and conductivity to analyze solute loading patterns during summer 2025. Using concentration-discharge (C-Q) plots and power-law models, the research aims to identify whether precipitation causes dilution, mobilization, or stable chemistry in streams, improving understanding of water quality drivers in mountain ecosystems dependent on snowpack.",Albion Basin and Red Butte Creek,"40.768635093523656, -111.82365398967248",Campus,Geology & Geophysics,Sara Warix,
Zachary Coons,Summer 25,Undergraduate,Sustainable Solid-State Cooling: Developing 2D Perovskites for Eco-Friendly Barocaloric Refrigeration,"The research addresses the environmental harm caused by conventional refrigeration systems relying on hydrofluorocarbon (HFC) gases, potent greenhouse gases with extremely high global warming potentials. It explores barocaloric cooling as a sustainable alternative, focusing on 2D inorganic-organic hybrid halide perovskites due to their promising thermal stability and barocaloric potential. The project aims to understand how modifications to the organic layers affect phase transition thermodynamics by synthesizing and characterizing tailored 2D perovskites. Over a 10-week summer period, the researcher plans systematic synthesis, characterization, and data analysis to advance eco-friendly cooling technologies that could reduce dependence on HFC-based refrigeration.",Department of Chemistry,"315 S 1400 E, SALT LAKE CITY, UT 84112",Campus,Chemistry,Connor Bischak,
Thomas Cooper,Summer 25,Undergraduate,A Geographic Discontinuity Analysis on the Effect of Public Land Protections on Wildfire Severity and Recovery,"This research investigates the causal effects of national parks and monuments on ecosystem health, using wildfire severity and recovery as proxies. By analyzing wildfires that cross park or monument boundaries—where environmental factors are constant—the study isolates the impact of differing land management policies. The researcher has pre-collected data and plans a phased approach: cleaning and refining datasets, identifying relevant fires, performing regression analyses, and creating maps to visualize findings. The study aims to provide insights into the effectiveness of protected areas in managing wildfire impacts, informing ongoing political debates about national park policies, especially relevant to Utah.",Utah National Parks,"37.386785244642645, -110.84246861872741",Utah,ENVST,Alberto Garcia,
Porter Edson,Summer 25,Undergraduate,Electrochemical Nitrile Reduction,"This research focuses on the electrochemical reduction of nitriles, particularly electrochemical decyanation, as a sustainable alternative for recycling nitrile butadiene rubber (NBR) waste into chemical feedstocks. Traditional decyanation methods use reactive or less selective reagents, limiting scalability and safety. The project aims to optimize reaction conditions—such as temperature, solvent, electrode material, current, and electrolyte—and explore the substrate scope by synthesizing various nitrile derivatives. Mechanistic studies, including cyclic voltammetry, Hammett plotting, and divided-cell experiments, will elucidate the reaction pathway. The research is supported by collaborative group meetings for feedback and aims to improve sustainable organic synthesis methods.",Department of Chemistry,"315 S 1400 E, SALT LAKE CITY, UT 84112",Campus,Chemistry,Qilei Zhu,
Lucy Engar,Summer 25,Undergraduate,Plant Responses to Heat and Vapor Pressure Deficit in the Intermountain West of the U.S.,"This study examines how temperate plant species in the Southwestern U.S. respond physiologically to increased heat and vapor pressure deficits (VPD) without soil water stress. Using 11 species (gymnosperms and angiosperms) irrigated on the University of Utah campus, the researcher measures leaf morphological, thermal, and water-use traits across spring and summer 2025. The goal is to identify species and clades sensitive to heat and atmospheric drought by analyzing traits like thermal safety margin, leaf water potential, and gas exchange. Data analysis will employ ANOVA, PCA, and regressions to understand ecological strategies under climate stress.",Southwest US,"35.24151756210802, -111.09035883544205",World,Biology,Luiza Aparecido,
Colby Estey,Summer 25,Undergraduate,Comparison of GPS and GRACE/GRACE-FO Geodetic Observations with Hydrologic Observations in the Salt Lake Valley,"This project investigates groundwater storage variability in Utah’s Salt Lake Valley (SLV), driven by seasonal snowmelt from the Wasatch Mountain Block (WMB) and influenced by multi-year climate cycles. Groundwater is a critical resource under pressure from population growth and climate warming. The research aims to improve water budget estimates by integrating hydrological data—such as Great Salt Lake water levels, SLV well levels, and streamflow—with geodetic observations from GPS and GRACE satellites. Using Principal Component Analysis, the study will identify temporal patterns and lags between hydrologic and geodetic data to better understand subsurface water storage dynamics and their role in regional water resources.",Salt Lake Valley and Wasatch Mountain Block,"40.63500409818432, -111.793407647266",Utah,Geology & Geophysics,Tonie van Dam,
Ellis Foster,Summer 25,Undergraduate,Using Drone-Based Remote Sensing and Geospatial Information Systems (GIS) to Analyze Vegetation Health and Stream Discharge in Wasatch Mountain Streams,"This study examines the relationships between vegetation health, groundwater levels, and streamflow in mountain watersheds of the western United States. Using drone-acquired Normalized Difference Vegetation Index (NDVI) data alongside hydrologic sensor measurements, the project investigates how plant water use correlates with water availability. By analyzing spatial and temporal variations in NDVI, stream discharge, and groundwater levels in Albion Basin and Red Butte Creek, the research aims to clarify whether vegetation greenness reliably indicates streamflow persistence. Results will enhance understanding of climate-driven hydrologic shifts and their impacts on mountain ecosystem stability and water resources management.",Red Butte Creek,"40.76588426425365, -111.82761097743897",Campus,Geology & Geophysics,Sara Warix,
Matthew Guthrie,Summer 25,Undergraduate,Disease Spillover Risk on Mammalian Species Across the United States,"This project analyzes disease spillover risk to mammalian species across the United States by assessing how anthropogenic factors influence wildlife distributions and disease risk hotspots. Utilizing the extensive Snapshot USA camera trap data (2019–2023), the study will integrate environmental covariates like population density and land cover to create a composite disease risk metric via Principal Component Analysis. A Bayesian multi-species hierarchical occupancy model will then evaluate how disease risk affects species distributions and whether susceptibility varies with species traits, functional guilds, or climatic conditions. The findings aim to improve understanding of how human disturbances impact wildlife disease dynamics nationwide.",School of Biological Sciences,"257 South 1400 East, 201, SALT LAKE CITY, UT 84112",Campus,Biology,Austin Green,
Jillian Hall,Summer 25,Undergraduate,Investigating the Impact of ANKLE2 Knockdown in Adult Neurons on Tau-Induced Neurodegenerative Phenotypes in Drosophila,"This project investigates the role of the gene ANKLE2 in modulating neurodegeneration induced by human Tau protein (hTau) in adult neurons, using Drosophila melanogaster as a model. Tauopathies, including Alzheimer’s disease, are characterized by toxic aggregation of hyperphosphorylated Tau protein. Preliminary data suggest ANKLE2 may protect against Tau aggregation, but its in vivo function in adult neurons remains unknown. By selectively knocking down ANKLE2 in adult fly neurons expressing hTau, the study will assess effects on lifespan, motor function, and neurodegeneration markers. Results could identify ANKLE2 as a novel therapeutic target for tauopathies.",Neuroscience Department,"20 South 2030 East, Salt Lake City, Utah 84112",Campus,Neuroscience,Nichole Link,
Megan Jones,Summer 25,Undergraduate,The Paper Nautilus: Differences of and Climate Implications for Argonauta Shells between Species a,"This research investigates the Paper Nautilus (Argonauta), a pelagic octopus with unique female biomineralized shells that protect eggs and aid swimming. The project focuses on understanding how different shell shapes influence hydrodynamic performance and shell repair after injury, using 3D scans of museum specimens. Given argonauts’ vulnerability to ocean acidification, shell durability is crucial. The researcher will edit scans, simulate fluid flow with software (Ansys Fluent), and analyze scar patterns to assess interspecies variation in shell function and healing. The findings will clarify ecological trade-offs and predict climate change impacts on argonaut species.",Global Oceanic Environments (Pelagic Zones),"23.48561719259785, -179.6848936928482",World,Geology & Geophysics,Kathleen Ritterbush (Allabush),
Jessica Kalinowski,Summer 25,Undergraduate,A Digital Model of Polar Bear Movement in Western Hudson Bay,"This project develops an individual-based movement model for Western Hudson Bay polar bears to understand ecological factors driving their movements. Using R programming, the model incorporates variables like sea ice, weather, and bear interactions, comparing simulated movements with 40 years of real tracking data, primarily from adult females. The researcher aims to extend the model to males and subadults, filling data gaps. The model will also be applied to climate projections to predict polar bear responses to future Arctic disturbances. Fieldwork in Churchill, Manitoba, and regular collaboration with advisors supports this research throughout 2025.",Hudson Bay,"52.85457643157959, -102.38833729994661",World,Biology,Jody Reimer,
Anshul Kasera,Summer 25,Undergraduate,Quantifying uncertainties in exposure health using conformal predictions.,"This research applies conformal prediction—a statistical method for reliable uncertainty quantification—to health data linking air quality exposures with disease outcomes like asthma, COPD, and obstructive sleep apnea. Unlike traditional models that give point estimates, conformal prediction provides prediction sets with confidence levels, enhancing interpretability and clinical trust. The study integrates diverse air quality datasets (PurpleAir, EPA, NASA) with health records to develop LSTM-based classifiers, applying conformal prediction to measure uncertainty across data sources. The goal is to improve robustness and reliability of AI-driven health predictions, bridging gaps between machine learning and practical clinical use.",Department of Biomedical Informatics,"421 Wakara Way, Ste 140, Salt Lake City, Utah 84108",Campus,Biomedical Informatics,Ramkiran Gouripeddi,
Ivan Khimach,Summer 25,Undergraduate,Advancing Research in Neuronal Mitochondrial Trafficking,"This project investigates mitochondrial trafficking in neurons using iPSC-derived organoids to better understand neurological disorders such as Alzheimer’s and Parkinson’s diseases. Mitochondrial transport is vital for neuronal energy distribution and calcium buffering, and its dysfunction is linked to various brain disorders. The research involves collecting live-cell imaging data on mitochondrial movement in mutated versus healthy neurons, analyzing motility metrics like speed and directionality, and examining how transport changes under synaptic activity and stress. The findings aim to clarify mitochondrial roles in neurodegeneration and explore therapeutic targets for neuronal survival and repair.",Neuroscience Department,"20 South 2030 East, Salt Lake City, Utah 84112",Campus,Neurobiology,Alex Shcheglovitov,
Alexander Lott,Summer 25,Undergraduate,Thermo-Mechanical Assessment of PCM-Enhanced Mortar Under Different Environmental Conditions,"This research focuses on improving building energy efficiency by enhancing the thermal properties of mortar through the incorporation of Phase Change Materials (PCMs), which absorb and release heat to reduce heating and cooling demands. The study specifically investigates whether PCM mortar cured in seawater maintains its mechanical strength and thermal performance compared to air-cured samples. Experiments will prepare and test samples under both conditions to evaluate compressive strength and thermal properties. Results will help determine the viability of PCM mortar for coastal infrastructure in diverse environments, enabling broader adoption for energy savings in buildings near seawater.","Miami, Florida","25.766314128065673, -80.20548460553053",World,Mechanical Engineering,Pania Newell,
Quinn Mckeon,Summer 25,Undergraduate,Quantifying Organic Carbon in Beaver Ponds: Implications for Carbon Sequestration and Climate Policy in Utah,"The research investigates how beaver-engineered wetlands influence carbon sequestration and greenhouse gas emissions. Beavers create wetlands that enhance organic carbon (OC) storage, potentially offering climate change mitigation through carbon credits. However, wetlands emit methane, complicating carbon budget assessments. This study aims to quantify OC in five beaver ponds in the Wasatch Mountains and Colorado foothills, analyzing sediment cores for mineralogy, grain size, and carbon forms to understand long-term carbon retention better. The findings will help develop predictive models of beaver wetlands’ role in carbon cycling, addressing uncertainties in their climate impact and supporting nature-based restoration strategies.",Colorado Foothills,"39.64562970853028, -105.09185844561844",World,Geology & Geophysics,Rachel Havranek,
Gavin Mclean,Summer 25,Undergraduate,Exploring the Potential of Ailanthus Altissima as a Zero-Waste Building Material.,"This research explores the potential of the invasive tree species Ailanthus altissima (""Tree of Heaven"") as a sustainable building material. Rapidly growing and ecologically disruptive in Utah and beyond, the tree’s wood exhibits promising mechanical and chemical properties for use in construction and bio-based materials. The project involves sourcing local samples, processing wood fibers, and testing their application as pore-forming agents in clay brick production. By repurposing this invasive species, the study aims to reduce environmental harm, promote zero-waste architectural practices, and offer a low-carbon alternative to traditional building materials, potentially bridging ecological management and sustainable design.",College of Architecture and Planning,"375 SOUTH 1530 EAST, SALT LAKE CITY, UT 84112",Campus,Architecure,Shundana Yusaf,
Sofia Mocuta,Summer 25,Undergraduate,Investigating Effects of Fine Scale Air Quality Changes on Animal Behavior,"This project investigates the effects of fine-scale air quality variations on wildlife behavior in Salt Lake City, a region challenged by climate-driven air pollution such as wildfire smoke and winter inversions. Using low-cost air quality monitors and wildlife camera traps along a transect of Red Butte Creek, the study aims to correlate particulate matter (PM2.5 and PM10) levels with changes in wildlife activity patterns across urban-wild gradients. The research addresses gaps in ecological studies caused by limited air quality data and seeks to inform conservation and urban planning strategies to protect both human and wildlife health amid increasing environmental stressors.",Department of Chemistry,"315 S 1400 E, SALT LAKE CITY, UT 84112",Campus,Chemistry,Austin Green,
Aditya Pandey,Summer 25,Undergraduate,"Geochemical signatures of reservoir mud deposits in three Colorado river tributary canyons previously inundated by Lake Powell Reservoir, Utah, US","This research examines sediment geochemistry in tributaries of Lake Powell exposed due to prolonged drought and reservoir drawdowns. It investigates how sediment mixing, bedrock composition, and stratigraphy influence geochemical signatures, using X-ray fluorescence (XRF) and statistical analyses to compare mud samples from different tributaries. The study assesses whether sediment provenance remains identifiable despite decades underwater and evaluates potential remobilization of contaminants like heavy metals. Findings will inform sediment management, reservoir capacity, and environmental risks to aquatic ecosystems and river users. The project also supports cultural landscape preservation and collaborates with public organizations to enhance environmental policy and management.",Lake Powell,"37.05905607869916, -111.28794726699091",Utah,Geology & Geophysics,Brenda Bowen,
Maxim Rassoul-Agha,Summer 25,Undergraduate,How does microbialite environment influence salinity tolerance in C. elegans?,"This research explores how bacteria from microbialite structures in the Great Salt Lake enhance salinity tolerance in halophilic nematodes. Lab nematode strains (C. elegans and P. pacificus) raised on microbialite bacteria showed significantly increased survival in high-salinity water, suggesting bacteria confer salt tolerance. The study aims to isolate and genome-sequence bacteria strains responsible for this effect and identify genes linked to osmoregulation. Using genetic tools and survival assays, researchers seek to uncover mechanisms enabling nematode survival in extreme saline environments. This work advances understanding of microbial-animal interactions and adaptations to harsh habitats.",Great Salt Lake,"41.34507192925411, -112.35928712796172",Utah,Biology,Michael Werner,
Kian Robison,Summer 25,Undergraduate,Heavy Metal and Trace Element Contamination in Oruro and Potosí: Implications for Public Health,"This research assesses elemental contamination in Oruro and Potosí, Bolivia—regions affected by centuries of mining and volcanic activity. The study investigates toxic trace elements such as arsenic, lead, mercury, vanadium, and uranium, alongside major elements like calcium and magnesium, to understand their distribution in soil and water. By analyzing samples collected from these areas, researchers aim to elucidate contamination pathways and assess potential human health risks including neurological, respiratory, and developmental effects. The project integrates geochemical analysis with health data to inform mitigation strategies and contribute to broader environmental and public health understanding in mining-impacted regions.",Bolivia,"-16.72332156490995, -64.73593428060626",World,Sociology,Akiko Kamimura,
Amishi Rohaj,Summer 25,Undergraduate,"Observing the difference in post-operative recovery outcomes between Arthritis patients with different pre-operative mental health statuses (e.g., anxiety, depression, stress) after joint replacement surgery.   ","This research investigates how preoperative mental health influences recovery after hip or knee joint replacement surgery in arthritis patients. Arthritis, primarily osteoarthritis and rheumatoid arthritis, causes joint pain and inflammation, often leading to joint replacement when severe. Mental health challenges, including anxiety and depression, are common among arthritis sufferers and can affect recovery outcomes. The project involves collecting and analyzing patients’ mental, physical, and social health data before surgery and tracking their recovery at three postoperative intervals: immediately after surgery, three months, and six months. The goal is to improve patient care by understanding mental health’s role in rehabilitation.",College of Health,"250 South 1850 East, Salt Lake City, UT 84112",Campus,Health,Jesse Christensen,
Ray Sanchez,Summer 25,Undergraduate,Dating of Quaternary Landforms Within the Little Cottonwood Oligocene Granitic Intrusion Using ¹⁰Be Surface Exposure Dating and Schmidt Hammer Measurements,"This research aims to streamline dating Quaternary landforms in Utah’s Little Cottonwood granitic intrusion by combining Schmidt hammer rebound measurements with traditional absolute dating methods like 10Be surface exposure dating. The relatively uniform rock type allows better correlation between rock surface hardness and landform age. Data collection includes measuring rebound values on numerous boulders from rock glaciers, landslides, and other deposits, along with collecting rock samples for precise dating. This approach will enhance understanding of Utah’s Quaternary paleo-geography, revealing insights into past climate changes through the dating of ice-formed landforms such as rock glaciers.",Little Cottonwood Canyon,"40.57251119050881, -111.77357587474793",Utah,Geology & Geophysics,Leif Anderson,
Sydney Smith,Summer 25,Undergraduate,Impact of Clausius-Clapeyron Thresholds and Monsoon Patterns on Extreme Precipitation Events in the Salt Lake Region,"This research investigates how climate change-driven temperature increases may alter precipitation extremes and flooding risks in Salt Lake Valley, Utah. Using climate model simulations (CMIP6) and Shared Socioeconomic Pathways (SSPs), the study analyzes precipitation variability, focusing on summer monsoonal storms. There is significant divergence in models projecting either doubled or halved precipitation ratios with a 5°C temperature rise, complicating flood risk predictions. The project employs quantile regression to examine extreme precipitation events and explores causes for model discrepancies, hypothesizing that differences in monsoon evolution—land-ocean temperature contrasts, wind flow, and sea level pressure—drive variability.",Salt Lake Valley,"40.533535301915585, -111.94784279164423",Utah,Atmospheric Sciences,Courtenay Strong,
Michael Broughton																									,Fall 23,Graduate,New Directions for Packrat Midden Research: Developing Isotopic Records of Long-Term Paleoclimate Change from Amberat Deposits,"This research focuses on reconstructing past climates and environments to address questions surrounding late Quaternary climate change in the Great Basin. It aims to generate high-resolution paleoclimate models that can help fill significant data gaps in arid regions of western North America. Key objectives include analyzing packrat diet and amberat isotope relationships, producing new isotope sequences, and integrating these data with climate models to interpret human-environment interactions. The project spans multiple disciplines—paleoecology, anthropology, geography, climatology, and ecology—and aligns with institutional research strengths in climate and environmental change. The work also serves as a master's thesis within a geography program.",Great Basin,"38.98113670539726, -114.2624501457372",World,Geography,Mitchell Power/Tyler Faith,
Skylar Fetter,Fall 23,Graduate,Disturbances: Cultural Stratification and Contamination on the Grasse River,"This thesis investigates the intersection of climate science, policy, and environmental remediation in Akwesasne, focusing on how climate change impacts Indigenous-led restoration efforts. The study critiques the EPA and Alcoa’s short-term cleanup measures, such as an armor cap already showing signs of failure, and elevates community concerns about climate-induced changes in river dynamics. By incorporating interviews with Akwesasne residents and collaboration with tribal remediation teams, the project examines the social, cultural, and ecological dimensions of contamination and restoration. It integrates perspectives from climate policy, contamination science, and Indigenous knowledge, highlighting the inseparability of environmental and sociocultural systems.","Akwesasne (territory spanning parts of New York State, Ontario, and Quebec, centered around the Grasse River)","44.58987837253405, -75.16159203872382",World,Environmental Humanities,Brett Clark,
